[
  {
    "fact_id": "fact:ACME:revenue:Q2-2026",
    "company_id": "ACME",
    "metric": "revenue",
    "xbrl_concept": "Revenues",
    "value": 1400000000.0,
    "unit": "usd",
    "currency": "USD",
    "scale": "units",
    "period_type": "duration",
    "period_start": "2026-04-01",
    "period_end": "2026-06-30",
    "fiscal_period": "Q2-2026",
    "dimension": null,
    "filing_type": "10-Q",
    "accession_number": "0001234567-26-000090",
    "filed_at": "2026-08-05",
    "retrieved_at": "2026-09-19T12:00:00Z",
    "source_url": null,
    "source_location": "xbrl:Revenues",
    "source_kind": "xbrl_reported",
    "derivation": null,
    "superseded_by": null
  },
  {
    "fact_id": "fact:ACME:net_income:Q2-2026",
    "company_id": "ACME",
    "metric": "net_income",
    "xbrl_concept": "NetIncomeLoss",
    "value": 176800000.0,
    "unit": "usd",
    "currency": "USD",
    "scale": "units",
    "period_type": "duration",
    "period_start": "2026-04-01",
    "period_end": "2026-06-30",
    "fiscal_period": "Q2-2026",
    "dimension": null,
    "filing_type": "10-Q",
    "accession_number": "0001234567-26-000090",
    "filed_at": "2026-08-05",
    "retrieved_at": "2026-09-19T12:00:00Z",
    "source_url": null,
    "source_location": "xbrl:NetIncomeLoss",
    "source_kind": "xbrl_reported",
    "derivation": null,
    "superseded_by": null
  },
  {
    "fact_id": "fact:ACME:op_cash_flow:Q2-2026",
    "company_id": "ACME",
    "metric": "op_cash_flow",
    "xbrl_concept": "NetCashProvidedByUsedInOperatingActivities",
    "value": 230000000.0,
    "unit": "usd",
    "currency": "USD",
    "scale": "units",
    "period_type": "duration",
    "period_start": "2026-04-01",
    "period_end": "2026-06-30",
    "fiscal_period": "Q2-2026",
    "dimension": null,
    "filing_type": "10-Q",
    "accession_number": "0001234567-26-000090",
    "filed_at": "2026-08-05",
    "retrieved_at": "2026-09-19T12:00:00Z",
    "source_url": null,
    "source_location": "xbrl:NetCashProvidedByUsedInOperatingActivities",
    "source_kind": "xbrl_reported",
    "derivation": null,
    "superseded_by": null
  },
  {
    "fact_id": "fact:ACME:capex:Q2-2026",
    "company_id": "ACME",
    "metric": "capex",
    "xbrl_concept": "PaymentsToAcquirePropertyPlantAndEquipment",
    "value": 70000000.0,
    "unit": "usd",
    "currency": "USD",
    "scale": "units",
    "period_type": "duration",
    "period_start": "2026-04-01",
    "period_end": "2026-06-30",
    "fiscal_period": "Q2-2026",
    "dimension": null,
    "filing_type": "10-Q",
    "accession_number": "0001234567-26-000090",
    "filed_at": "2026-08-05",
    "retrieved_at": "2026-09-19T12:00:00Z",
    "source_url": null,
    "source_location": "xbrl:PaymentsToAcquirePropertyPlantAndEquipment",
    "source_kind": "xbrl_reported",
    "derivation": null,
    "superseded_by": null
  },
  {
    "fact_id": "fact:ACME:eps_diluted:Q2-2026",
    "company_id": "ACME",
    "metric": "eps_diluted",
    "xbrl_concept": "EarningsPerShareDiluted",
    "value": 0.45,
    "unit": "usd_per_share",
    "currency": "USD",
    "scale": "units",
    "period_type": "duration",
    "period_start": "2026-04-01",
    "period_end": "2026-06-30",
    "fiscal_period": "Q2-2026",
    "dimension": null,
    "filing_type": "10-Q",
    "accession_number": "0001234567-26-000090",
    "filed_at": "2026-08-05",
    "retrieved_at": "2026-09-19T12:00:00Z",
    "source_url": null,
    "source_location": "xbrl:EarningsPerShareDiluted",
    "source_kind": "xbrl_reported",
    "derivation": null,
    "superseded_by": null
  },
  {
    "fact_id": "fact:ACME:shares_diluted:Q2-2026",
    "company_id": "ACME",
    "metric": "shares_diluted",
    "xbrl_concept": "WeightedAverageNumberOfDilutedSharesOutstanding",
    "value": 395000000.0,
    "unit": "shares",
    "currency": null,
    "scale": "units",
    "period_type": "duration",
    "period_start": "2026-04-01",
    "period_end": "2026-06-30",
    "fiscal_period": "Q2-2026",
    "dimension": null,
    "filing_type": "10-Q",
    "accession_number": "0001234567-26-000090",
    "filed_at": "2026-08-05",
    "retrieved_at": "2026-09-19T12:00:00Z",
    "source_url": null,
    "source_location": "xbrl:WeightedAverageNumberOfDilutedSharesOutstanding",
    "source_kind": "xbrl_reported",
    "derivation": null,
    "superseded_by": null
  },
  {
    "fact_id": "fact:ACME:cash:Q2-2026",
    "company_id": "ACME",
    "metric": "cash",
    "xbrl_concept": "CashAndCashEquivalentsAtCarryingValue",
    "value": 1000000000.0,
    "unit": "usd",
    "currency": "USD",
    "scale": "units",
    "period_type": "instant",
    "period_start": null,
    "period_end": "2026-06-30",
    "fiscal_period": "Q2-2026",
    "dimension": null,
    "filing_type": "10-Q",
    "accession_number": "0001234567-26-000090",
    "filed_at": "2026-08-05",
    "retrieved_at": "2026-09-19T12:00:00Z",
    "source_url": null,
    "source_location": "xbrl:CashAndCashEquivalentsAtCarryingValue",
    "source_kind": "xbrl_reported",
    "derivation": null,
    "superseded_by": null
  },
  {
    "fact_id": "fact:ACME:total_debt:Q2-2026",
    "company_id": "ACME",
    "metric": "total_debt",
    "xbrl_concept": "DebtLongtermAndShorttermCombinedAmount",
    "value": 1150000000.0,
    "unit": "usd",
    "currency": "USD",
    "scale": "units",
    "period_type": "instant",
    "period_start": null,
    "period_end": "2026-06-30",
    "fiscal_period": "Q2-2026",
    "dimension": null,
    "filing_type": "10-Q",
    "accession_number": "0001234567-26-000090",
    "filed_at": "2026-08-05",
    "retrieved_at": "2026-09-19T12:00:00Z",
    "source_url": null,
    "source_location": "xbrl:DebtLongtermAndShorttermCombinedAmount",
    "source_kind": "xbrl_reported",
    "derivation": null,
    "superseded_by": null
  },
  {
    "fact_id": "fact:ACME:revenue:FY2025",
    "company_id": "ACME",
    "metric": "revenue",
    "xbrl_concept": "Revenues",
    "value": 5000000000.0,
    "unit": "usd",
    "currency": "USD",
    "scale": "units",
    "period_type": "duration",
    "period_start": "2025-01-01",
    "period_end": "2025-12-31",
    "fiscal_period": "FY2025",
    "dimension": null,
    "filing_type": "10-K",
    "accession_number": "0001234567-26-000010",
    "filed_at": "2026-02-20",
    "retrieved_at": "2026-09-19T12:00:00Z",
    "source_url": null,
    "source_location": "xbrl:Revenues",
    "source_kind": "xbrl_reported",
    "derivation": null,
    "superseded_by": null
  },
  {
    "fact_id": "fact:ACME:net_income:FY2025",
    "company_id": "ACME",
    "metric": "net_income",
    "xbrl_concept": "NetIncomeLoss",
    "value": 592000000.0,
    "unit": "usd",
    "currency": "USD",
    "scale": "units",
    "period_type": "duration",
    "period_start": "2025-01-01",
    "period_end": "2025-12-31",
    "fiscal_period": "FY2025",
    "dimension": null,
    "filing_type": "10-K",
    "accession_number": "0001234567-26-000010",
    "filed_at": "2026-02-20",
    "retrieved_at": "2026-09-19T12:00:00Z",
    "source_url": null,
    "source_location": "xbrl:NetIncomeLoss",
    "source_kind": "xbrl_reported",
    "derivation": null,
    "superseded_by": null
  },
  {
    "fact_id": "fact:ACME:op_cash_flow:FY2025",
    "company_id": "ACME",
    "metric": "op_cash_flow",
    "xbrl_concept": "NetCashProvidedByUsedInOperatingActivities",
    "value": 850000000.0,
    "unit": "usd",
    "currency": "USD",
    "scale": "units",
    "period_type": "duration",
    "period_start": "2025-01-01",
    "period_end": "2025-12-31",
    "fiscal_period": "FY2025",
    "dimension": null,
    "filing_type": "10-K",
    "accession_number": "0001234567-26-000010",
    "filed_at": "2026-02-20",
    "retrieved_at": "2026-09-19T12:00:00Z",
    "source_url": null,
    "source_location": "xbrl:NetCashProvidedByUsedInOperatingActivities",
    "source_kind": "xbrl_reported",
    "derivation": null,
    "superseded_by": null
  },
  {
    "fact_id": "fact:ACME:capex:FY2025",
    "company_id": "ACME",
    "metric": "capex",
    "xbrl_concept": "PaymentsToAcquirePropertyPlantAndEquipment",
    "value": 250000000.0,
    "unit": "usd",
    "currency": "USD",
    "scale": "units",
    "period_type": "duration",
    "period_start": "2025-01-01",
    "period_end": "2025-12-31",
    "fiscal_period": "FY2025",
    "dimension": null,
    "filing_type": "10-K",
    "accession_number": "0001234567-26-000010",
    "filed_at": "2026-02-20",
    "retrieved_at": "2026-09-19T12:00:00Z",
    "source_url": null,
    "source_location": "xbrl:PaymentsToAcquirePropertyPlantAndEquipment",
    "source_kind": "xbrl_reported",
    "derivation": null,
    "superseded_by": null
  },
  {
    "fact_id": "fact:ACME:eps_diluted:FY2025",
    "company_id": "ACME",
    "metric": "eps_diluted",
    "xbrl_concept": "EarningsPerShareDiluted",
    "value": 1.48,
    "unit": "usd_per_share",
    "currency": "USD",
    "scale": "units",
    "period_type": "duration",
    "period_start": "2025-01-01",
    "period_end": "2025-12-31",
    "fiscal_period": "FY2025",
    "dimension": null,
    "filing_type": "10-K",
    "accession_number": "0001234567-26-000010",
    "filed_at": "2026-02-20",
    "retrieved_at": "2026-09-19T12:00:00Z",
    "source_url": null,
    "source_location": "xbrl:EarningsPerShareDiluted",
    "source_kind": "xbrl_reported",
    "derivation": null,
    "superseded_by": null
  },
  {
    "fact_id": "fact:ACME:shares_diluted:FY2025",
    "company_id": "ACME",
    "metric": "shares_diluted",
    "xbrl_concept": "WeightedAverageNumberOfDilutedSharesOutstanding",
    "value": 400000000.0,
    "unit": "shares",
    "currency": null,
    "scale": "units",
    "period_type": "duration",
    "period_start": "2025-01-01",
    "period_end": "2025-12-31",
    "fiscal_period": "FY2025",
    "dimension": null,
    "filing_type": "10-K",
    "accession_number": "0001234567-26-000010",
    "filed_at": "2026-02-20",
    "retrieved_at": "2026-09-19T12:00:00Z",
    "source_url": null,